創傷転倒トリビュートシュガーニュース,1980,978-1-62518-197-8
創傷インチオークション風景バスケット,1920,978-1-08-800737-2
革新ピックはチーズ葉残る転倒行進コンペ,1985,978-0-9970792-8-9
教授柔らかい偏差職人チーズ怒りトースト,1932,978-1-5252-2472-0
スマッシュ創傷葉暖かい動物職人文言,1955,978-1-00-638575-9
符号クロスソース花嫁ブラケット衝突鉱山,2009,978-1-128-53405-9
符号ヒット省略試してみる電話叔父必要,1908,978-0-385-40822-6
ダッシュトーン不自然な証言する舗装革新,1995,978-1-892064-38-7
状況知覚フレームジャム供給トーン,1978,978-0-15-865698-4
残るハンマー分割バーゲンキャビンクール,1906,978-0-571-77022-9
呼ぶクロスブレーキ尿クール状況本質的な,2017,978-1-395-92459-1
再現する〜戦略的ホイール移動コンペ文言,1975,978-1-967793-73-0
見出し符号特徴主婦パイオニア〜癌雪〜,1995,978-1-5191-2999-4
カレッジコンペ普通のコミュニケーション,2002,978-1-948292-28-3
反射私タワー感謝するストレージ中央,1970,978-1-06-547205-6
カレッジ目的再現するマリンバスケット,2000,978-0-587-06189-2
ピック教授コンペ緩むヒットキャビン,2011,978-0-589-45959-8
極端な改善〜管理するないコミュニティ私,1900,978-0-587-75456-5
部隊動物画面トーンストレージ〜ささやき,1901,978-1-70756-573-3
トス織る状況創傷連続インチ近代化する,1983,978-0-900744-74-7
